{"type":"config","name":"minimize binary size","metric":"binary_size_kb","unit":"KB","direction":"lower","created_at":"2026-04-18T00:00:00Z"}
{"type":"run","iteration":1,"metric":"binary_size_kb","value":1696,"outcome":"keep","description":"Replace reqwest with ureq + release profile (strip, lto, opt-z, codegen-units 1, panic abort)","asi":{"hypothesis":"reqwest pulls tokio async runtime + TLS stack; ureq is sync-only with native TLS; release profile strips debug info and enables LTO","next_action_hint":"try disabling default features on ratatui and crossterm"}}
{"type":"run","iteration":2,"metric":"binary_size_kb","value":1696,"outcome":"discard","description":"Disable default features on ratatui/crossterm","asi":{"rollback_reason":"No size change - crossterm is pulled in anyway via ratatui dep","next_action_hint":"try replacing ureq with minreq for even smaller HTTP"}}
{"type":"run","iteration":3,"metric":"binary_size_kb","value":919,"outcome":"keep","description":"Replace ureq with minreq (even smaller HTTP client)","asi":{"hypothesis":"minreq has fewer deps than ureq, especially around TLS stack","next_action_hint":"try using minreq https-rustls instead of https-native, or try minreq without TLS + custom rustls"}}
{"type":"run","iteration":4,"metric":"binary_size_kb","value":1403,"outcome":"discard","description":"Switch minreq from https-native to https-rustls","asi":{"rollback_reason":"rustls embeds crypto + root certs in binary (+484 KB vs native-tls which dynamically links system TLS)","next_action_hint":"try opt-level s instead of z, or try removing anyhow"}}
{"type":"run","iteration":5,"metric":"binary_size_kb","value":1094,"outcome":"discard","description":"Switch opt-level from z to s","asi":{"rollback_reason":"opt-level z produces 175 KB smaller binary than s for this codebase","next_action_hint":"try removing anyhow (use Box<dyn Error> instead) or try home crate instead of dirs"}}
{"type":"run","iteration":6,"metric":"binary_size_kb","value":919,"outcome":"keep","description":"Replace dirs with home crate (-3 deps, same size)","asi":{"hypothesis":"home is simpler than dirs - only finds home dir, no XDG/app dirs","next_action_hint":"profile which sections of the binary are biggest - try cargo-bloat or just look at dep sizes"}}
{"type":"run","iteration":7,"metric":"binary_size_kb","value":919,"outcome":"discard","description":"Minimize crossterm features","asi":{"rollback_reason":"ratatui controls crossterm features internally, our crossterm dep features dont matter","next_action_hint":"try replacing clap derive with manual arg parsing to remove syn + clap_derive"}}
{"type":"run","iteration":8,"metric":"binary_size_kb","value":919,"outcome":"keep","description":"Disable clap color+suggestions features (-9 deps)","asi":{"hypothesis":"removing clap color/suggestions removes ansi_term and strsim deps","next_action_hint":"at 919 KB we are near the floor for this dep set. remaining size is ratatui+crossterm+serde+clap core. could try removing serde derive for manual impls but code churn is huge"}}
{"type":"run","iteration":9,"metric":"binary_size_kb","value":0,"outcome":"crash","description":"Remove anyhow dependency","asi":{"hypothesis":"removing anyhow causes type conflicts - Result alias clashes with parse_key_val, crossterm needs Send+Sync errors","next_action_hint":"anyhow is tiny after LTO - not worth the code churn. we are at the floor at 919 KB"}}
